{
  "allVisualsRequired": true,
  "arms": [
    "main",
    "candidate"
  ],
  "budget": {
    "capUsd": 20,
    "includesDiscardedAndInterruptedAttempts": true,
    "scope": "cumulative-job",
    "spentUsd": 15.520774000000001
  },
  "cohorts": {
    "development": 40,
    "heldout": 20
  },
  "credentialsAndEnvExcluded": true,
  "files": [
    {
      "bytes": 8933,
      "path": "README.md",
      "role": "documentation",
      "sha256": "6c7229f323371aa5073867bb41c3a421154b8525e19b8aa35924e82faeb18e83",
      "sourcePath": "/Users/kaizen/conductor/workspaces/heytutor/provo/.context/h3r8/finish-regions/report-tools/README.md",
      "sourceSha256": "6c7229f323371aa5073867bb41c3a421154b8525e19b8aa35924e82faeb18e83"
    },
    {
      "bytes": 5615,
      "path": "assemble-evidence.py",
      "role": "helper",
      "sha256": "4756625a91b214828b5d2317e505a2a01525e91880a8a4bb93d34f61703d2365",
      "sourcePath": "/Users/kaizen/conductor/workspaces/heytutor/provo/.context/h3r8/finish-regions/report-tools/assemble-evidence.py",
      "sourceSha256": "4756625a91b214828b5d2317e505a2a01525e91880a8a4bb93d34f61703d2365"
    },
    {
      "bytes": 4481,
      "path": "calibration/consistency.json",
      "role": "calibrationConsistency",
      "sha256": "b1afed450c44874f21564cb1ccf8ad538d4fda23acf1023e50c7462188f46f03",
      "sourcePath": "/Users/kaizen/conductor/workspaces/heytutor/provo/.context/h3r8/finish-regions/followup-settlement-repaired/calibration-consistency.json",
      "sourceSha256": "b1afed450c44874f21564cb1ccf8ad538d4fda23acf1023e50c7462188f46f03"
    },
    {
      "bytes": 8140,
      "path": "calibration/grades-a.jsonl",
      "role": "calibrationGrade",
      "sha256": "b89ce44ec28e1c56c32e70cebf976c8fcb4ba12920615418b726c4ac03d498d9",
      "sourcePath": "/Users/kaizen/conductor/workspaces/heytutor/provo/.context/h3r8/finish-regions/followup-settlement-repaired/judges/calibration-a/grades.jsonl",
      "sourceSha256": "b89ce44ec28e1c56c32e70cebf976c8fcb4ba12920615418b726c4ac03d498d9"
    },
    {
      "bytes": 9449,
      "path": "calibration/grades-b.jsonl",
      "role": "calibrationGrade",
      "sha256": "bfd7f07377b204d314d413aec748f498124d74e68c6d9207470eb22783604d98",
      "sourcePath": "/Users/kaizen/conductor/workspaces/heytutor/provo/.context/h3r8/finish-regions/followup-settlement-repaired/judges/calibration-b/grades.jsonl",
      "sourceSha256": "bfd7f07377b204d314d413aec748f498124d74e68c6d9207470eb22783604d98"
    },
    {
      "bytes": 9066,
      "path": "calibration/grades-c.jsonl",
      "role": "calibrationGrade",
      "sha256": "9089a5d1a926854c8247e787b879ea6955f737094bfc3af6722b649836325838",
      "sourcePath": "/Users/kaizen/conductor/workspaces/heytutor/provo/.context/h3r8/finish-regions/followup-settlement-repaired/judges/calibration-c/grades.jsonl",
      "sourceSha256": "9089a5d1a926854c8247e787b879ea6955f737094bfc3af6722b649836325838"
    },
    {
      "bytes": 23774,
      "path": "calibration/images/reference-08978cee79dc13d6a76abeaa.png",
      "role": "calibrationImage",
      "sha256": "3b5fd8f24ec6514f08bd796f6461d3305970b60d6f54f61607257ba269b41b58",
      "sourcePath": "/Users/kaizen/conductor/workspaces/heytutor/provo/.context/h3r8/finish-regions/followup-settlement-repaired/packets/calibration-neutral/images/reference-08978cee79dc13d6a76abeaa.png",
      "sourceSha256": "3b5fd8f24ec6514f08bd796f6461d3305970b60d6f54f61607257ba269b41b58"
    },
    {
      "bytes": 19112,
      "path": "calibration/images/reference-0fb7c4907a14f03db5190399.png",
      "role": "calibrationImage",
      "sha256": "04d5d3281bc2ec0c7070472663ec4f5631c548bf4fb2a14bf0ad539bc6c7c573",
      "sourcePath": "/Users/kaizen/conductor/workspaces/heytutor/provo/.context/h3r8/finish-regions/followup-settlement-repaired/packets/calibration-neutral/images/reference-0fb7c4907a14f03db5190399.png",
      "sourceSha256": "04d5d3281bc2ec0c7070472663ec4f5631c548bf4fb2a14bf0ad539bc6c7c573"
    },
    {
      "bytes": 12145,
      "path": "calibration/images/reference-13fff3eebc4a802fc880278b.png",
      "role": "calibrationImage",
      "sha256": "586d1c0f17e145bdd5b0f4f59d34eae894887f018c9008efd279accab3134f5a",
      "sourcePath": "/Users/kaizen/conductor/workspaces/heytutor/provo/.context/h3r8/finish-regions/followup-settlement-repaired/packets/calibration-neutral/images/reference-13fff3eebc4a802fc880278b.png",
      "sourceSha256": "586d1c0f17e145bdd5b0f4f59d34eae894887f018c9008efd279accab3134f5a"
    },
    {
      "bytes": 25037,
      "path": "calibration/images/reference-17ecd9d16398d2d34025f356.png",
      "role": "calibrationImage",
      "sha256": "f32ca42524c1de2a19a195ce7362fc4a620a5d9d4f0c16bb2a2044303adc1c6a",
      "sourcePath": "/Users/kaizen/conductor/workspaces/heytutor/provo/.context/h3r8/finish-regions/followup-settlement-repaired/packets/calibration-neutral/images/reference-17ecd9d16398d2d34025f356.png",
      "sourceSha256": "f32ca42524c1de2a19a195ce7362fc4a620a5d9d4f0c16bb2a2044303adc1c6a"
    },
    {
      "bytes": 27399,
      "path": "calibration/images/reference-1cec7843c5c0e80242c2ad5c.png",
      "role": "calibrationImage",
      "sha256": "349339b5bd7b36da5a42c4492a4814eb30f9e2a2139574efe6ae927a8db63328",
      "sourcePath": "/Users/kaizen/conductor/workspaces/heytutor/provo/.context/h3r8/finish-regions/followup-settlement-repaired/packets/calibration-neutral/images/reference-1cec7843c5c0e80242c2ad5c.png",
      "sourceSha256": "349339b5bd7b36da5a42c4492a4814eb30f9e2a2139574efe6ae927a8db63328"
    },
    {
      "bytes": 19156,
      "path": "calibration/images/reference-48e284b8c877687eb50d9cae.png",
      "role": "calibrationImage",
      "sha256": "cb2925728cbbd499d0d5dc79b9ae3e804abab6ffaa38fd0aae7336acc2432321",
      "sourcePath": "/Users/kaizen/conductor/workspaces/heytutor/provo/.context/h3r8/finish-regions/followup-settlement-repaired/packets/calibration-neutral/images/reference-48e284b8c877687eb50d9cae.png",
      "sourceSha256": "cb2925728cbbd499d0d5dc79b9ae3e804abab6ffaa38fd0aae7336acc2432321"
    },
    {
      "bytes": 16866,
      "path": "calibration/images/reference-5cdd7d5790a0de6a5ca2321c.png",
      "role": "calibrationImage",
      "sha256": "9db7b818fcbd4576c31ec6d93f4ddbb708cab39209131c78ce027b34996f09d2",
      "sourcePath": "/Users/kaizen/conductor/workspaces/heytutor/provo/.context/h3r8/finish-regions/followup-settlement-repaired/packets/calibration-neutral/images/reference-5cdd7d5790a0de6a5ca2321c.png",
      "sourceSha256": "9db7b818fcbd4576c31ec6d93f4ddbb708cab39209131c78ce027b34996f09d2"
    },
    {
      "bytes": 19862,
      "path": "calibration/images/reference-5ff12ddaf334027165136015.png",
      "role": "calibrationImage",
      "sha256": "8eb363e3d3af984e3511235b95e924a7a183f8562278e2a2fb27820e0d597db5",
      "sourcePath": "/Users/kaizen/conductor/workspaces/heytutor/provo/.context/h3r8/finish-regions/followup-settlement-repaired/packets/calibration-neutral/images/reference-5ff12ddaf334027165136015.png",
      "sourceSha256": "8eb363e3d3af984e3511235b95e924a7a183f8562278e2a2fb27820e0d597db5"
    },
    {
      "bytes": 26990,
      "path": "calibration/images/reference-633986b84215edd72383e232.png",
      "role": "calibrationImage",
      "sha256": "364c84303186e68b32d77ea45869c2b02bed85086e209c316b4ace07a4010120",
      "sourcePath": "/Users/kaizen/conductor/workspaces/heytutor/provo/.context/h3r8/finish-regions/followup-settlement-repaired/packets/calibration-neutral/images/reference-633986b84215edd72383e232.png",
      "sourceSha256": "364c84303186e68b32d77ea45869c2b02bed85086e209c316b4ace07a4010120"
    },
    {
      "bytes": 20345,
      "path": "calibration/images/reference-6401205a76513bbc90fdde6c.png",
      "role": "calibrationImage",
      "sha256": "098c55c6e0dec1f227aab7fe745656f97f2ed1a2188a68db9beaa4372525e994",
      "sourcePath": "/Users/kaizen/conductor/workspaces/heytutor/provo/.context/h3r8/finish-regions/followup-settlement-repaired/packets/calibration-neutral/images/reference-6401205a76513bbc90fdde6c.png",
      "sourceSha256": "098c55c6e0dec1f227aab7fe745656f97f2ed1a2188a68db9beaa4372525e994"
    },
    {
      "bytes": 18228,
      "path": "calibration/images/reference-70cb97f739722d1b8f99ecfd.png",
      "role": "calibrationImage",
      "sha256": "5b8a174d313a595631c4e851259dd321247df5d3453415c957d3419ef4938c57",
      "sourcePath": "/Users/kaizen/conductor/workspaces/heytutor/provo/.context/h3r8/finish-regions/followup-settlement-repaired/packets/calibration-neutral/images/reference-70cb97f739722d1b8f99ecfd.png",
      "sourceSha256": "5b8a174d313a595631c4e851259dd321247df5d3453415c957d3419ef4938c57"
    },
    {
      "bytes": 10545,
      "path": "calibration/images/reference-73641c97e53ce760f59de8b5.png",
      "role": "calibrationImage",
      "sha256": "42c63c8ea4d6c3bc991df745bf123f25ab99b631d5afefcbb0dea7ef8c6dcabc",
      "sourcePath": "/Users/kaizen/conductor/workspaces/heytutor/provo/.context/h3r8/finish-regions/followup-settlement-repaired/packets/calibration-neutral/images/reference-73641c97e53ce760f59de8b5.png",
      "sourceSha256": "42c63c8ea4d6c3bc991df745bf123f25ab99b631d5afefcbb0dea7ef8c6dcabc"
    },
    {
      "bytes": 17325,
      "path": "calibration/images/reference-7533454a280f9c4b731997fd.png",
      "role": "calibrationImage",
      "sha256": "330488a5bb22e1448c8418b3c913c3499fcb48a365276b266d81a9c4115aa592",
      "sourcePath": "/Users/kaizen/conductor/workspaces/heytutor/provo/.context/h3r8/finish-regions/followup-settlement-repaired/packets/calibration-neutral/images/reference-7533454a280f9c4b731997fd.png",
      "sourceSha256": "330488a5bb22e1448c8418b3c913c3499fcb48a365276b266d81a9c4115aa592"
    },
    {
      "bytes": 19438,
      "path": "calibration/images/reference-790589788e2d7a4370519b17.png",
      "role": "calibrationImage",
      "sha256": "37e2273d8b812795fbe1cdf4ced82e7e86bfab837b147deb7d1a10af8dc21f71",